{"acknowledgment":null,"clarifications":["What feels unclear or unsettled about that for you?"],"comparison":{"criteria":["pros","cons","risks","unknowns"],"rows":[{"option_id":"option-1","values":["","","",""]},{"option_id":"option-2","values":["","","",""]}]},"contradiction":null,"flags":{"ambiguous":true,"contradiction":false,"freeze_signal":false,"frozen_state":false,"refuse_signal":false,"short_or_vague":false,"stop_signal":false,"stopped_state":false,"summarize_signal":false},"observations":[],"options":[{"cons":[],"id":"option-1","pros":[],"risks":[],"title":"Should I schedule the meeting at 9:00","unknowns":[]},{"cons":[],"id":"option-2","pros":[],"risks":[],"title":"9:05? Either works for me","unknowns":[]}],"reflection":"What I'm hearing is: Should I schedule the meeting at 9:00 or 9:05? Either works for me..","response_text":"What I'm hearing is: Should I schedule the meeting at 9:00 or 9:05? Either works for me..\nWhat feels unclear or unsettled about that for you?","run_header":{"contract_version":"1.0","input_hash":"6039a0afbf3dd31104fd51f96dacb6bb5624fd75a430adf04139dae4169d5cf1","model_version":"CogA-1.0-pro","reasoning_pack_id":"default","reasoning_pack_version":"1.0","run_hash":"5b1b1f0d5014b2232093b730e389408a7f05e6a6987a72751b23f0567ad90b06","schema_version":"1.0"},"summary":null}
