{"acknowledgment":null,"clarifications":["What feels unclear or unsettled about that for you?"],"comparison":{"criteria":["pros","cons","risks","unknowns"],"rows":[{"option_id":"option-1","values":["","","",""]},{"option_id":"option-2","values":["","","",""]}]},"contradiction":null,"flags":{"ambiguous":true,"contradiction":false,"freeze_signal":false,"frozen_state":false,"refuse_signal":false,"short_or_vague":false,"stop_signal":false,"stopped_state":false,"summarize_signal":false},"observations":[],"options":[{"cons":[],"id":"option-1","pros":[],"risks":[],"title":"We could pick sushi, pizza, tacos,","unknowns":[]},{"cons":[],"id":"option-2","pros":[],"risks":[],"title":"ramen for dinner tonight. Which should we choose","unknowns":[]}],"reflection":"What I'm hearing is: We could pick sushi, pizza, tacos, or ramen for dinner tonight. Which should we choose?.","response_text":"What I'm hearing is: We could pick sushi, pizza, tacos, or ramen for dinner tonight. Which should we choose?.\nWhat feels unclear or unsettled about that for you?","run_header":{"contract_version":"1.0","input_hash":"a3e596b39495476143b15e959658b9dfc41afd780ec688e2858e53da49cff39e","model_version":"CogA-1.0-pro","reasoning_pack_id":"default","reasoning_pack_version":"1.0","run_hash":"5e773827eb1dc67fc2300e529a6c6f9c973bcb56844e2bc58a1c4f4a5b9729ee","schema_version":"1.0"},"summary":null}
