{"acknowledgment":null,"clarifications":[],"comparison":null,"contradiction":null,"flags":{"ambiguous":false,"contradiction":false,"freeze_signal":false,"frozen_state":false,"refuse_signal":false,"short_or_vague":false,"stop_signal":false,"stopped_state":false,"summarize_signal":false},"observations":[],"options":[],"reflection":"What I'm hearing is: I like coffee and tea equally this morning. Which should I pick?.","response_text":"What I'm hearing is: I like coffee and tea equally this morning. Which should I pick?.","run_header":{"contract_version":"1.0","input_hash":"86f949d0197a65412bc1886c9c581febcd301114c8f985007dd747376b4d9c8d","model_version":"CogA-1.0-pro","reasoning_pack_id":"default","reasoning_pack_version":"1.0","run_hash":"53b0357bbabff1924979113735ed1495f10616da9befcbe9f509c242e99616b5","schema_version":"1.0"},"summary":null}
