{"acknowledgment":null,"clarifications":[],"comparison":null,"contradiction":null,"flags":{"ambiguous":false,"contradiction":false,"freeze_signal":false,"frozen_state":false,"refuse_signal":false,"short_or_vague":false,"stop_signal":false,"stopped_state":false,"summarize_signal":false},"observations":[],"options":[],"reflection":"What I'm hearing is: Compare working remotely versus in an office and highlight trade-offs..","response_text":"What I'm hearing is: Compare working remotely versus in an office and highlight trade-offs..","run_header":{"contract_version":"1.0","input_hash":"70db2a8cf80d054bafc3ba41ec1de9265665a3a4df4bb8c12818e8bc139fdeb6","model_version":"CogA-1.0-pro","reasoning_pack_id":"default","reasoning_pack_version":"1.0","run_hash":"96d29ffa4681b8a6432cd6288b4df9402844bff9323890f89ed6f73adc2b1ae5","schema_version":"1.0"},"summary":null}
