{"acknowledgment":null,"clarifications":["What feels unclear or unsettled about that for you?"],"comparison":null,"contradiction":{"earlier":"I want apples","later":"I don't want apples"},"flags":{"ambiguous":false,"contradiction":true,"freeze_signal":false,"frozen_state":false,"refuse_signal":false,"short_or_vague":false,"stop_signal":false,"stopped_state":false,"summarize_signal":false},"observations":[],"options":[],"reflection":"What I'm hearing is: I don't want apples.","response_text":"Potential contradiction noticed: earlier you said \"I want apples\", later you said \"I don't want apples\".\nWhich one reflects what you mean right now?","run_header":{"contract_version":"1.0","input_hash":"ebb03f2c804df44738a5708dd9f71d2b22d54e6625a8616e44c135715fdc3605","model_version":"CogA-1.0-pro","reasoning_pack_id":"default","reasoning_pack_version":"1.0","run_hash":"a791c9970eb997b5714f493c31d39c94e7b16576fd286e3b7942049f47b1a9d3","schema_version":"1.0"},"summary":null}
