{"acknowledgment":null,"clarifications":[],"comparison":null,"contradiction":null,"flags":{"ambiguous":false,"contradiction":false,"freeze_signal":false,"frozen_state":false,"refuse_signal":false,"short_or_vague":false,"stop_signal":false,"stopped_state":false,"summarize_signal":false},"observations":[],"options":[],"reflection":"What I'm hearing is: Book the best flight to NYC for me..","response_text":"What I'm hearing is: Book the best flight to NYC for me..","run_header":{"contract_version":"1.0","input_hash":"7a9a11f24d32ed3e6d23949e208ba67108eeaeb217e619ac1f75f99526ac8c45","model_version":"CogA-1.0-pro","reasoning_pack_id":"default","reasoning_pack_version":"1.0","run_hash":"57f87db3ef1e615c618e4c9e84585608829c3a7e08bb5b8569e6c87024033770","schema_version":"1.0"},"summary":null}
