{"acknowledgment":null,"clarifications":["What feels unclear or unsettled about that for you?"],"comparison":{"criteria":["pros","cons","risks","unknowns"],"rows":[{"option_id":"option-1","values":["","","",""]},{"option_id":"option-2","values":["","","",""]}]},"contradiction":null,"flags":{"ambiguous":true,"contradiction":false,"freeze_signal":false,"frozen_state":false,"refuse_signal":false,"short_or_vague":false,"stop_signal":false,"stopped_state":false,"summarize_signal":false},"observations":[],"options":[{"cons":[],"id":"option-1","pros":[],"risks":[],"title":"Should I invest in index fund A","unknowns":[]},{"cons":[],"id":"option-2","pros":[],"risks":[],"title":"index fund B","unknowns":[]}],"reflection":"What I'm hearing is: Should I invest in index fund A or index fund B?.","response_text":"What I'm hearing is: Should I invest in index fund A or index fund B?.\nWhat feels unclear or unsettled about that for you?","run_header":{"contract_version":"1.0","input_hash":"5e299e5919524da5c0d075df43ac25b5286d900b5d9d24d1f1a398838248de2e","model_version":"CogA-1.0-pro","reasoning_pack_id":"default","reasoning_pack_version":"1.0","run_hash":"23f844e340399206c662399200db467e1530307298a94a7073d2dd3a207f9a00","schema_version":"1.0"},"summary":null}
