{"acknowledgment":"Intent frozen. I'll stop here.","clarifications":[],"comparison":null,"contradiction":null,"flags":{"ambiguous":false,"contradiction":false,"freeze_signal":true,"frozen_state":true,"refuse_signal":false,"short_or_vague":false,"stop_signal":false,"stopped_state":true,"summarize_signal":false},"observations":[],"options":[],"reflection":"","response_text":"Intent frozen. I'll stop here.","run_header":{"contract_version":"1.0","input_hash":"40ad002a4b021039c4e218ade5492c0358f7199c8a7e66ca42baa3bde64a6b0a","model_version":"CogA-1.0-pro","reasoning_pack_id":"default","reasoning_pack_version":"1.0","run_hash":"00f9efa8e2972b9b812ec6c2b3597d60285f5bfef30ad72314f66c22a2cad898","schema_version":"1.0"},"summary":null}
